,label,sentence
5524,sadness,When I was trying for a girl who I really liked and cared for and á thought she felt the same way too. But she didn't like the idea á and just wanted to stay friends.
5570,joy,My last genetices midterm - a decent grade.
29,fear,"When one has arranged to meet someone and that person arrives á late, in the meantime one starts thinking about all that could á have gone wrong e.g a traffic accident."
4306,guilt,Family discord and uneasiness due to something I did not á communicate on time.
4528,shame,I greeted and embraced the wrong person thinking that it was my á friend.
484,sadness,When I first heard that Tage Dannielsson had died.
7068,joy,Talking to a close friend.
721,fear,"A \near-accident\"" in a car, driving too fast on an icy road."""
3121,disgust,I had a very good friend (boy) and I thought I could rely on him á but he behaved badly with a girl who used to trust us completely.
1856,joy,On my birthday a friend came to see me unexpectedly and brought á me flowers. I usually do not see her very often.
3179,guilt,When I had lied to a friend/son about some things we had á discussed and I had to be one better.
1037,disgust,"In the army, I had been in hospital for two weeks and as soon as á I returned to the company, a sergeant ordered me to fetch a load á on the tractor trailer."
3504,disgust,"I deliberately avoided a person who I wanted to hurt, and who á wanted to talk to me."
1708,guilt,"By fun I had a tussle with my sister. Suddenly I obviously hurt á her unintentionally - and she ran out of the room, crying."
1934,sadness,The death of my twin sister - suicide.
5506,shame,Since I've been here I haven't written to any of my relatives. I got á a letter from my mom telling me how upset my grandparents are á from not hearing from me.
1193,guilt,When I think that I have been too stict or narrow minded towards á my students.
1602,sadness,"I felt very sad when I had to give up something that by right was á mine and although I didn't get it, a kind of suvenir that people á don't give you the right to have."
2816,shame,A young visitor to the house stole money from an elderly á visitor's purse. It wasn't noticed for some hours.
2241,fear,"On embarking on University life. I came from a different city and á did not know anybody at the Uni. I was frightened because my well á known and loved friends, also all my security had been taken á away."
2077,guilt,"I felt guilty when I skipped a two hour practical class I knew I á would miss out on more information which I did not know, but I á couldn't cope with going."
1433,sadness,"After I had lived with my boyfriend in a foreign country for half á a year, I saw that it was impossible for me to stay with him (for á economic reasons). We separated although I loved him."
2104,shame,When my friends were rude to a girl. 
6006,shame,I got into a tight pair of trousers and examined myself in the á mirror.  My back looked unpresentable and I felt ashamed at my á wanting to wear those clothes that day.  I quickly changed into á another dress.
1486,joy,"At a choral concert I appeared as a solist. The concert5 was very á good, I forgot all the hard work that had been done before. There á remained only an undescribable joy and a feeling of warmth, á security etc."
6187,disgust,My elder sister forced me to do a few things which I did not like á to do.
3298,fear,Waiting for a taxi - when within 1/2 an hour two separate people á challenged me to fight for no apparent reason except they were á drunk.
5575,shame,Not doing my share of the work for the house job.
6867,disgust,Saw my brother-in-law insulting my sister.
3644,fear,When the relationship with my first girlfriend broke up and I á realized it too late.
3322,disgust,Reading literature on AIDS/homosexuality.
643,joy,When I fell in love.
5850,fear,I overturned in a canoe a few years back and I didn't know how to á swim. Although I had a life-jacket on I still panicked.
1052,shame,"As a little girl, I was sick in the middle of a school day and I á vomitted in the basin of the classroom."
1226,disgust,When I saw a spider.
3976,sadness,When I noticed that my parents were not in such a prosperity as á most people in my surroundings.
3154,anger,I took part in a football match. The referee was extremely á partial to the opposite team. This stirred up my discontent and á anger.
2573,guilt,"The greatest guilt I felt and I didn't know if it was really á justified is that when I was a child I had a brother very close á to me. He  became ill, and asked me to see  him in the hospital. á I didn't go, when his situation became worse in the U.I.T. (Unity á of intensive therapy) I went and he died."
5050,anger,One of my colleagues accused me of having stolen his iron and I á was sure that I had done no such thing.
375,guilt,When I demand too much from my friends.
4092,anger,"We hitch hiked our way back from a town rather drunk.  We were á dropped in another town which was unknown to us.  I needed to á urinate, so I did it on a wall which turned out to belong to the á military headquarters.  They arrested me and made me pay a fine á of 500 pts.  We had to go home on foot (6 km) since it was too á late for anyone to give us a lift."
7051,disgust,Someone told me he was chosen for the English lectures because he á was a good friend of the class leader.
557,disgust,"During the week-end at home, my mother fries greasy and unhealthy á meat dishes which make me feel sick."
1178,shame,"I feared that I would have to describe my sexual life to an á older, strange woman."
2715,guilt,I felt guilty after I battered to death a classmate of mine.
478,disgust,"When I woke up one morning and went to the kitchen I discovered á that our dog had diarrhoea.  There were small \piles\"" all over á the floor and the smell was choking."""
5342,disgust,When my elder brother failed form five in 1968 when I was 5 years á old.
3840,anger,I work at a petrol station. When there is a foreigner who wants á petrol my collegues treat him very impolite.
1528,joy,After a weekend at a seminar I saw my husband again. I hurried á home hoping he would be there. We embraced - I enjoyed feeling á his body.
6005,disgust,"When we complained about the uncleanliness of the work place, the á authorities agreed to have the place cleaned.  Even after 2-3 á days nothing had been done.  I felt disgusted at the whole á situation."
1599,joy,"When I get something that seemed very hard like getting a job, a á boyfriend, etc. A specific sutuations, was when I started to date á a boy whom I liked for a long time."
3369,anger,Arriving home from work after a long and tiring day to find no á dinner prepared as I had expected.
3942,disgust,I feel disgust when hearing or seeing other people being treated á inhumanely. For example torturing in chili.
4884,disgust,"When thieves broke into our house, I was disgusted by their á behaviour.  They did not find anything so they broke things like á the windows, glasses etc."
4226,sadness,When summer is over and I have to leave the town where I spend my á holidays.
1448,disgust,A drunken man forced me to kiss him.
2700,sadness,A close friend decided to stop with his study and to go back á home.
5206,guilt,"In the begining of teenage, on the matters of sex - speaking á about sex."
1419,sadness,A person died (not really a friend).
7010,disgust,Saw Chinese people flattering foreigners.
1316,fear,"I awoke at night and did not remember dreaming about antthing in á particular.  I just felt oppressing fear, it was dark and all the á others were sleeping."
2490,joy,When I discovered that I and my friend would be licensed at the á first call. This emotion was accompanied by a great relief. It á was the coronation of a year of sacrifice and extrene discipline.
7157,shame,Failed in a piblic argument.
2864,guilt,I forgot to convey an important announcement.
135,anger,"When a colleague asked me for help at work, despite the fact á that he had more time to do it than I had."
4277,shame,When people next to me play the fool.
3387,guilt,Two timing - going out with 2 guys at once (secretly).
7596,joy,"I had a dream : I had a very close friend who had several stone á houses in the New Territories (villages) but they did not have á much furniture.  He took me to see his fields (I had never seen á them before) and there were several inches of clear water on á which the sunshine was reflected.  I wanted to sit among the á short green plants in the fields but was afraid of treading the á plants to death.  My friend said \They will not die\"" and I sat á down happily and my trousers did not get wet."""
124,shame,"When my boyfriend revealed that he knew that I had discovered á things of an important nature about him, I felt ashamed as I had á not mentioned it earlier."
503,fear,"When I missed crashing, by a hair's breadth, into a man who came á out 20 metres ahead of me when I was driving at 110km/h."
5983,sadness,When my elder sister died.
5684,anger,While I was away for the weekend some friends went into my room á and played my very expensive stereo without asking me or my á roommate.
6358,fear,I felt the above condition when I took my brother's bicycle to a á market and unfortunately the bicycle was stolen and I didn't know á how I could tell the owner about the stolen bicycle.
1116,guilt,"When I behaved improperly - fought in a public place.  á Afterwards, I felt guilty about my conduct."
6582,anger,There was a cup final match between Limbe Leaf Wanderers and á Silver Strikers and someone promised to give me some money for á admission fee to watch this game. Unfortunately he did not give á me.
5101,disgust,When I heard that my sister had shouted at my friend's cousin at á their place.
30,anger,When one is unjustly accused of something one has not done.
4157,disgust,When I see people who have no sentiments.
5201,fear,Once I woke up in the middle of the night and felt frightened as á everyone else was sleeping and I could not even go to their á room.
2381,shame,It was my birthday and all the members of the group made me a á surprise in a public place at 10 p.m. giving me flowers and suvenirs.
1922,shame,I am ashamed of the horrible way I used to treat my little á sister.
2059,anger,"At the hardware store, trying to convert Imperial to Metric á measurements, I made a mistake, and didn't buy enough tiles for á the bathroom. I was angry at myself, because I hope to be a Maths á teacher."
4223,joy,When I saw that the mark I had obtained in an exam was a good á one.
5023,sadness,When I lost my grandmother.  She had been my guardian after the á death of my father.
4242,shame,When a friend from whom I preferred to hide my private life á discovered that I had relations with a man.
2729,guilt,Some time ago I slapped my son without trying to understand who á the real culprit of a damage was. After that I felt guilty and á bad but it was too late.
6883,guilt,My mother wrote me and said that I would not writ enough letters á home.
5402,disgust,When a close friend of mine maintained a relationship with me á till she needed me and broke it off when she did not need me.  á She behaved life a really selfish person.  
1458,joy,"On our way to France, my girlfriend and I went to Verona. By á chance we met an Italian couple - they gave us two tickets for á the dress-rehearsal of \Aida\"". It was a different world for us á full of fascination. After the representation we ate a phantastic á pizza in a restaurant near the \""Arena\""."""
7581,guilt,"Once, my friend and I went to the Tai 60 to cycle.  My mother had á told me not to go.  Unfortunately I broke my pectoral girdle and á had to go to hospital.  When my mother  came to see me I felt á guilty as I had not listened to her and I had to soon sit for a á public examination."
6652,anger,When I damaged my wristwatch which I liked very much.
7501,sadness,There was a conflict of interest between me and a close friend of á mine.  He only thought about his own interest and not about our á friendship.  This behaviour hurt his friends.  Another incident á is when a friend isolated himself without giving any reasons.
6094,anger,"One day my elder brother badly scolded my father.  This was the á first time that I heard such abusive language from my brother.  I á requested him humbly not to use this kind of language but he did á not care for what I was saying.  Finally I picked up an axe to use á against him, in the meanwhile people intervened."
2497,joy,I felt joy when I entered at the University.
2463,fear,I was sitting on the bus coming back from school. A man from á nearly forty years sat beside me. After a while I looked at him á and saw that he was looking at me with opened throusers and á holding his penis.
2151,anger,When I was left by the person I loved without any reason.
2040,disgust,"When I heard that one of my good friends, when at a party, had á got herself involved with some very undesirable characters and á was experimenting with drugs."
593,anger,During a fight with my best friend.
3901,joy,After I saw my family and good friends back after staying one á year in a foreign country. 
1484,shame,"I tried to pass an examination particularly well, but I did it á worse than ever. I felt ashamed."
3230,shame,I found I was pregnant and unmarried.
4170,sadness,All my friends arranged to go for an afternoon snack and they did á not tell me.  They told me that they did not have my phone number á but I do not think that this was true.
2167,disgust,To go through the underground way at suburb station of LAPA. Poor á people and the ambulants badly dressed up in a passage badly á kept.
4115,disgust,When I saw a scene on T.V where a castration was shown.
7222,joy,Success in university entrance examination.
2821,sadness,I was driving near my girlfriend's house and I decided to keep á going because it was late and I would be back in the next few á days anyway. The next day she was killed in a road accident.
6845,sadness,My girl-friend left me.
5241,fear,"The first day that I was close to a dead body, in my third year á at UNZA, school of medicine."
6984,guilt,Losing my temper to my sister.
3830,guilt,A friend of mine had a bicycle-accident because I pulled at his á handlebar.
3151,guilt,Something very unpleasant happened when I was a soldier and I was á directly involved in it.
1555,disgust,Some time ago a girl tried to make me up without any action of my á part. She used all possible means. Although I behaved refusingly á she did not give up for a longer time.
800,disgust,Close friends talking badly of other friends.
5603,shame,"When I was 10, I got busted for stealing a candy-bar."
6661,disgust,I felt disgusted when my appointment to meet the E.N.T. á specialist had been turned down. The specialist came from U.K. á and went the same day and we do not have one.
4187,guilt,I left a boy with whom I was going around without giving him any á explanations.
1918,fear,I was walking home late at night from lectures and someone á deliberately started following me. It was dark and I was scared.
1476,disgust,I saw a physically handicapped young man whose spittle ran out of á his mouth while speaking.
7544,disgust,A brother from one of the Christian fellowship often phoned me á and talked to me for half an hour or more.  However there was á nothing important in the conversation and I found the person very á disgusting.
7601,shame,"My teacher reminded us not to do a Summer job, however I did it á for two months.  Yesterday I was chatting with my teacher and á when we talked of the Summer job, I felt ashamed."
1721,shame,"When I had slept with a boy for the first time I felt ashamed for á three reasons. First, because I was only 13 years old, second, á because I did not really like him, third, because he had caught á me napping."
4245,fear,"When I was walking down the street, some boys showed me a knife á and stole all my money."
6439,shame,I once proposed my own niece whom I did not know but I discovered á after she was my girlfriend.
7413,guilt,I had promised myself that I would do one good deed every day.  á One night I saw a beggar whose muscles had been atrophyed.  I á walked passed him thinking that he was feigning.  Later I á realized that he had not been pretending and I had a feeling of á guilt as I had not kept my promise.
2569,anger,"And she said absurd things, false things that filled my ears and á inflated my head which seemed to be caught in a carcass where the á heart wanted to explode and where the arm wanted to knock down á the world."
2396,guilt,I broke the gutar of a colleague but as it happened in a moment á when nobody was present I could escape from the guilt.
168,disgust,Nothing.
1143,shame,"Again, a quarrel had come up in our difficult relationship.  My á life-partner threw all the books off the shelf.  I am sure that it á disturbed our neighbours since this happened late in the night."
4691,joy,"When my uncle gave me my first year's results.  I opened the á envelope and my eyes ran into two \B+\"" - in EC110 and M160, this á meant that I had qualified for a major in economics."""
7452,sadness,When I learnt that my close friend was going to immigrate.
3166,joy,Being invited out by a person I wished to get closer to. He á telephoned and invited me to go out with him the next night.
316,sadness,"When I left New York, and all my family and my friends behind me."
57,fear,"When, as a child, I was nearly knocked down by a car."
5387,fear,When I was first taken to the dissection room where I found 10 dead á human bodies.
4146,joy,When I passed an important exam.
1516,anger,At the end of my holiday job I got less money than was due to me á and nobody mentioned anything about that.
6291,disgust,[ No response.]
5989,anger,"One morning I was standing at the bus-stop and the bus passed by á without stopping, even though there were only 8-10 passengers á inside.  I felt angry at the rude behaviour of the bus driver and  á conductor."
5660,guilt,I told my parents (or more realistically) would not do what they á wanted me to do anymore. I guess I sort of betrayed them after á all they had done for me.
6905,joy,Scoared a goal in a football match.
3330,shame,"My first real experience with a boy. We were alone. I was quite á young and pretty naive and he was pretty crude and real, sort of, á macho. It was dark, at night during the summer and we were á talking."
483,anger,"At a cash desk where I had gone to buy 16 rolls of kitchen paper á at a reduced price.  After queuing with screaming children; it á turned out that I had taken two 8 roll packets instead of the one á 16 roll packet to which the rebate applied.  The assistant said á \You will have to get it another time.\"""""
84,joy,When I won a trip to Greece in a competition.
3448,disgust,"I once saw an old man up the road, fossicking through the rubbish á bins and the gutter. I was really disgusted at first but I've á seen him a few times since then and now I feel really sorry for á him and I often give him cigarettes when I see him, because he á mainly goes after cigarette butts and it is revolting."
4182,fear,There was an earthquake for several minutes and I was on the á eight floor.
3241,anger,When present boyfriend's mother approached my parents and self - á to leave her son alone - as she did not want me for a future á daughter-in-law.
1025,shame,When my friend let my personal matters be publicaly known.
2331,joy,Always when I am well succeded.
450,disgust,When I tried to explain to my child as to why there were á magazines wiith naked girls on them at the kiosk.
1236,joy,I had just moved to the town where I study and I got a postcard á from a good friend (from my home town).
2512,fear,I had an important amount of money with me and felt fear of being á assaulted.
3373,guilt,Breaking the left hand indicator box by moving too close to á structure.
6505,anger,It was when my friend had stolen my money (K10) and had á disappeared.
2812,fear,"While tramping on a narrow path two of us were confronted by a á woman with two snarling dogs, demanding we get off the property - á via a flooded river !"
5125,joy,When I was selected to this university despite my having á studyied in difficulty throughout my secondary school days.
6515,shame,"I was in my room, I just heard that my Uncle had been caught in á somebody's house with somebody's wife. He had to appear in court. á I went to see what would happen to him."
6181,shame,"When I was in the 12th standard, I could not speak English.  One á day, while  talking with my relatives I used a wrong word and  á my cousin corrected me, believing that I did not know English.  I á really felt ashamed then.á "
7342,disgust,"When I dined with my new friends, one of them kept reminding us á that he was superior."
5433,shame,Not chosen for all English classes.
5483,sadness,After receiving the grade on the paper mentioned in FEAR.
1415,guilt,"I live with my boyfriend, we have a close relationship, I fell in á love with another man."
4518,anger,My mother read a letter that a friend of mine had written to me á telling me how she had got drunk the last time.
621,guilt,When a mistake occurred at work which I was not responsible for.  á This was disclosed later.
1435,shame,"When I talked to a psychotherapist for the first time, I started á to cry; first I talked to him but he did not say anything and á after a while I was crying."
522,guilt,[ No response.]
2139,joy,Can't remember specific event - besides just being moderately á happy until a year or so ago.
3083,fear,This was what I felt when my boyfriend went to Bourgas to study á there. I had the feeling I would lose him. Anyway the distance á Plovdiv-Bourgas seemed to me so great.
6251,disgust,Someone not responding to my criticism.
3961,anger,My boyfriend told me that I had very high demands towards him. In á my opinion this was wrong.
5811,disgust,I attended a ceremony in Denmark which is comparable to our á Halloween. They build a large bonfire and place a life size dummy á of a witch. The crowd cheered when the dummy burst into flames.
4847,anger,I was badly beaten up by one of my friends during a wedding á party.
400,sadness,When the result of a project work was treated nonchalantly á intead of being criticized by the teacher.
6553,fear,When it was found that I had gone out of the school premises á without permisssion and at the wrong time.
6419,guilt,I felt guilty when I was given a prize which belonged to someone á else.
6523,guilt,When I didn't notify someone that he was summoned by a headmaster á and as a result he ended being on a heavy punishment.
5705,anger,When some friends betrayed my friendship.
6644,fear,When the week for Exams came. I got afraid as to how I would á tackle the questions.
7588,guilt,I went to a friend's baptism as she became a Christian after me á and I realized that she was more enthusiastic about her spiritual á life than I was.  When I was with my brothers and sisters of á Christ I had a guilty feeling which could not be dismissed á easily.  When pepole asked me as to when I would be baptised my á guilt feeling deepened.
6714,fear,"I felt so afraid when dad fell ill, he had never suffered from á that disease since and I had never seen him as he was."
5228,anger,When my room-mate locked up the keys of my room in our room after á I had told her that I was  only in the bathroom having a shower. á  She left and I had to do without supper.
1544,joy,"I went to buy a bicycle with my father. When I wanted to pay, my á father took his purse and payed."
4380,disgust,"My dog had been run over and died near the house.  We had to pick á him up, cold and glassy eyed, to get rid of the corpse."
13,guilt,When my uncle and my neighbour came home under police escort.
6277,anger,Insulted by some stupid people.
789,joy,"When the person that I was very fond of, returned to me."
5635,anger,When someone told a secret I told them not to tell.
540,fear,"When I have to leave the baby in the carriage and go shopping, I á fear that something will happen to the baby."
1820,guilt,My father had been alone for a long time because my mother and á sister were on holiday. I had not seen him for a long time and á when I finally called him I realized that he had been very sad á about that.
131,shame,"When I had not prepared my contribution to the group as á thoroughly as the other members, with the result that the á overall result was poor."
3306,anger,When a close friend failed to live up to the expectations I had á of him - thereby causing pain to his spouse. I believe that my á anger was probably a reaction of fear that I wouldn't be able to á live up to my own expectations.
46,disgust,When I nearly walked on a blindworm and then saw it crawl away.
5740,sadness,My grandfather died thirteen years ago.
4781,guilt,When I cheated my father about the book allowance at university.  á He discovered that we were given K150 per year for books.
6314,guilt,[ I can positively say that I have never done anything that made á me feel guilty.]
79,anger,I locked myself out.
3847,anger,The stories about the way my grandmother treated my mother.
5257,sadness,I remember being sad whe my aunt's child died (2 days old).
2216,disgust,Someone smoking on Electric train (Electric trains are á non-smoking) with alcohol smell coming from person.  
6445,disgust,When I entered the wound intensive care at the Central Hospital á in Blantyre which was stinking.
3285,anger,That a friend had been badly beaten and stabbed many times and á the person that did it got away without any punishment from the á law.
5793,joy,"After being depressed because of a very bad relationship, my á first love called me and told me that he would always care for me á no matter what I did."
