,label,sentence
5359,joy,When the Cambridge results came out and I obtained a first á division.  I had been thinking that I had not done very well.
4878,shame,I felt ashamed of myself the first time I drank as nobody in the á family drinks.  I felt that I had let down my parents and my á friends.
7201,joy,Going to see a good film with my best friend.
6367,sadness,I had a girlfriend who lived several kilometers away from my á home. One day she wrote me that she'd visit me. On her way she á had a car accident and was badly injured. I was very sorry to see á her lying in a bed in the hospital.
798,anger,"My nephew is a deaf and also \hyperactive\"" boy. I had been á responsible for looking after him for a full day, and was very á tired. Then he suddenly grabbed a knife and stabbed me in the á leg. I got so angry that I didn't feel any pain."""
1830,anger,"A friend had promised to get me a book which was very important á for my work, but she forgot it."
686,fear,After mischieviously ringing on the chemist's trade-entrance á doorbell and getting caught by him.
5894,sadness,[ When my elders do not understand me in the right way.]
2785,anger,I have a friend that I deeply trusted but it happened that I lost á my confidence in her for which she herself was to blame.
2050,joy,"Eating biscuits and drinking Milo (Chocolate energy drink made á with milk and usually drunk warm) with my friend at College. We á get on really well, don't withold any feelings about each other's á friends and are pretty good at cheering each other up when we are á homesick."
6522,shame,When a certain girl I believed to be my life partner refused an á engagement.
3970,disgust,I saw a dog who was eating excrements.
2485,anger,"I don't use to lie to my parets about what I do, and the two á times that I felt anger were when they doubted me I said that I á was going to the club, and they didn't believe me because the day á before they had met me at FLIPERAMA. I had the wish to kill them."
921,guilt,Not helping parents enough at home and at the farm - this has á happened many times.
2422,disgust,When I felt the smell of industries that pollute.
4889,anger,"I was asked to stop studying economics, a field which interested á me, by my employers."
4240,sadness,I had a quarrell with my boyfriend and decided to finish with him á and and my Easter holidays.
6822,fear,I had fear of my father (parents) when I first became pregnant. I á was afraid of delivery itself and whether I would give birth to a á stiiborn or a baby.
3042,joy,When I knew that my husband and I were going to have a child.
6705,guilt,I cheated my boyfriend.
7166,joy,Going to a concert.
2088,sadness,Thinking about friends overseas.
4917,anger,At boarding school someone put a lot of tiny thorns on my bed.  á When I complained everybody began teasing me and laughing at my á inability to find out my enemies.  I lost my temper.
2651,sadness,Getting separated from my family for a week caused me a sense of á sadness.
2723,joy,That was what I felt when I was finally accepted in the Bulgarian á Conservatorie after I had applied a couple of years.
1976,sadness,At rejection / being ignored by a loved person held in great á esteem.
4595,anger,A certain friend tried to push me off a seat in a very violent á way for no apparent reason.  It may be that he was excited about á something.
2008,joy,"Arriving in New Zealand as a teenager - first overseas trip - á something \exhilarating\"" about the change of scenery etc."""
7287,shame,"I had obviously done the work badly but my class-mates of the á student's association did not blame me, they helped me do the á work."
300,fear,My 2 year old daughter disappeared in a moment of inattention; I á was responsible for her.
6778,guilt,I felt guilty the other day because I took two pieces of bread á instead of one in the Cafeteria and some of the girls were short á of bread.
5968,anger,"One of my friends asked me to go shopping with her, another á friend of hers was also coming along.  During the outing they á kept talking to each other and I felt left out, even when I tried á to talk to them they seemed not to listen to me and did not pay á me much attention."
6931,shame,Arguing about price with private shop-assistant.
7007,fear,Earth crake.
3550,fear,At the age of 12 years I always had to take care of my little á brother and sister I never could sleep then. I always imagined á creepy men sneaking into our house.
3519,shame,I was amongst a group of people talking about how the Maori á people were stirrers and causing trouble in our country. I felt á shame to be a pakeha when other pakehas had such narrow á conservative views.
6895,disgust,When I was the South Koreans on the TV.
6359,anger,I felt angry when my only pair of trousers was stolen and could á not be able to find out who the thief was or anyone who knew á about the story.
3516,anger,"I lent a text-book to a person I did not know very well, they á lost the text-book and gave me no compensation."
3237,shame,NO RESPONSE.
6120,joy,When India first won the world cup cricket tournament.
5548,guilt,When I did not go to work because I had to study for a midterm.
719,guilt,I hit my little sisiter on the head with a stone while we were á fighting.
4865,guilt,When my aunt went out of her way to help me out with my financial á problems.
1956,disgust,Disgust with oneself after being intoxicated enough to go to bed á with a stranger.
4959,anger,"When I could not reason my friend, it angered me."
1507,joy,A friend of mine often had difficulties with her parents. Once á she had a child she had a better relationship with them.
564,disgust,"When I went home by train from Sicilia, I was molested by a man."
7260,guilt,Not getting an airplane ticket fot my mother.
3152,joy,"I felt the greatest burst of joy when after being heavily ill for á a long period, my father came back home."
4580,fear,When my brother hit his head and lost consciousness at the sports á practice.  For some time he could not remember what had happened á but he recovered later.
1962,sadness,"When I left my sister's house after staying there for a few days. á She has two little boys, and they are very warm people (the á family). At the time, I was in need of this sort of contact, and á I grew very fond of children (no, I'm not a paedophiliac)."
6055,shame,"I remember that once, a friend did not co-operate with me due to á some unavoidable reasons.  Unaware of this I treated her unjustly á till I realized everything, and then I felt ashamad of my deeds. "
4385,anger,My father began to say incoherant things concerning my brother's and á my own behaviour towards him.  His biased (authoritarian) and á ridiculous point of view made us angry.
3030,anger,With the girl whom I may be loved truly. When she refused to come á with me to an occasion (she was from another town).
7508,sadness,About two years ago my girlfriend suggested that we separate.  á This really gave me a shock as I had never thought that she would á say such things.  The reason she gave me was that we were not á suited for each other.
6304,sadness,When my first love was not successful.
1099,sadness,"When my boyfriend wanted to leave me, I felt sad and melancholic."
5166,joy,"Right before I went to a concert with my last boyfriend he told á me that although he told me he was going to take me to the á concert, he didn't want to see me anymore. After that we stayed á overnight and I said \well, when he leaves me I will be ruined á for awhile, but for now we're together.\"" I woke up in his arms á and it was the happiest moment of my life."""
3292,anger,"When bicycling along, a courier van started to tail me very close á - I sped up and moved over and he just did the same. I reacted á violently, much physical responding in the dangerous situation."
2087,anger,When a friend wouldn't speak to me and wouldn't tell me why.
1097,fear,"I feared that I was pregnant.  It was not planned and I would á have been compelled to have an abortion, which I would not have á liked at all.  Fortunately, after a week's anxiety, I got to know á that I was not pregnant."
371,anger,When my mother interfered in my life.
4319,shame,When I fell head on in a fountain.
6456,fear,As I was in a ward one man died and I was instructed to watch the á last offices. But this was my first time to see a dead person - á fear came.
2686,guilt,"I was involved in a ... attempt on a man I had developed a close á warming relationship with. Although I knew I had done everything á I could and that his progress of a \normal\"" life was poor I felt á guilty as if I could have done more."""
7496,shame,"One day, when I was sitting on the bus, there was an old woman á standing beside me.  I was very tired and sleepy and did not á think of giving her my seat.  A 50 year old woman who was sitting á beside me got up and gave her seat to the old woman and said,  á \ Old woman, please take my seat, the youngstters these days are á not used to giving their seats to others.\""  When I heard these á words I was very ashamed of myself and wanted to get off the bus á at once.  """
3974,fear,When I slipped on a glazed frost road and a car almost ran into á me.
7313,sadness,The death of my father.
6510,joy,Time had struck 8 o'clock when I heard from the radio that I had á been selected to Robert Blake Secondary School for Form I. I was á very happy for the selection. My parents and I were very happy á and full of joy.
1137,guilt,"When before the last exam I have taken, I went out instead of á studying."
7571,sadness, [ No response.]
7587,shame,"When I was in lower six I joined an interview group to á interview the general public.  One of my friends in the group á lost her purse and she was very nervous.  Five of us had to go á another place so we left her, and planned to see her later.  Then á I heard her describing how her purse looked.  I realized that I á had seen her purse on the floor and had not wanted to do any á thing about it. "
3804,shame,When I could not hold my bladder while making a telephone call á and ended up wetting myself.
2908,fear,"I felt fear once, when the car in which I travelled directed á towards the precipice along the road."
5719,anger,"When a friend carelessly broke and object in my parent's house á and did not apologize, or pay, or anything."
550,disgust,"I happened to see the video-tape movie \This is America - Part á one\"" at my friend's place."""
7053,guilt,Late for a lecture and therefore missed it.
2350,shame,"In the last day of carnaval I met a boy and began to flirt with á him. I was in love with him. When he introduced me to his friends á I died of shame because I was with them before, I met my á boyfriend in carnaval."
2333,anger,I feel anger when things don't come out as I wish.
7206,shame,China not winning more gold medals in the Asian Olympics.
2800,sadness,Guy I cared for went back to Canada to live.
3201,joy,When my daughter was born.
3323,shame,I am ashamed at myself sometimes when I am working with á handicapped people and don't wish to be seen in public with them.
3347,fear,Haven't been frightened for ages.
6902,disgust,Some foreign students playing loud music late at night.
3754,anger,"When talking with my sister, she often ventilates prejudices, á which my father also adheres."
4832,fear,Birds had made nests in our thatched roof and they were flying á and flapping their wings in the bedroom at night.  It was very á dark and I could not even see my nose.  I did not know that it á was the birds till my mother told me so.
616,fear,When I am travelling by car and have to meet an oncoming car á while overtaking.
3807,disgust,People who discriminate other people disgust me.
247,fear,I was driving and a deer suddenly appeared in front of the á car when there was a lot of traffic behind me.
3137,guilt,I felt guilty when I failed to take an exam though I had had á enough time to read for it but I hadn't made use of it.
7555,fear,"One year, when I went to a camp, I was chased by a dog.  I tried á hard and finally managed to escape from it.  My torch suddenly á went off and we talked about ghost stories and I thought that á there were ghosts."
1118,fear,My father had been drinking and I feared him when we went to bed á at night.
330,sadness,I felt sad and depressed when I heard that our cat had died.
3812,anger,Meddlesomeness of my mother about the way I live. She thinks I am á to free in my behavior for instance when a boyfriend stays the á night.
6832,disgust,Given duty by the leaders which I do not like to do.
4761,joy,"When a girl I wanted very much, said \yes\"" and fell in love with  á me."""
3430,joy,When my brother who has been out of New Zealand for 10 years came á to visit with his wife which none of our family had previously á met.
6901,sadness,Hearing about developments of sience in the West a lot better á than China.
7309,guilt,"I cut a friend's hair in anger, without any consideration."
3660,sadness,"My mother was stuck by an apoplectic fit, was hemi-paralyzed and á suffered an aphasia."
1374,shame,I was very fat and felt absolutely unwell. I was afraid of á leaving the house and getting to know new people.
5683,fear,Taking a chemistry midterm.
1389,guilt,"I was supposed to fetch some friends at the bus stop, but I did á not do it because my father was in a bad mood and I was afraid á that he would grumble."
3443,guilt,"When my sister had the opportunity to do some modelling work. And á I was quite jealous - later on the photographer decided not to á take her photograph, and she was very upset - I felt guilty as a á result, almost as if I had caused her to lose her opportunity, by á not being genuinely happy for her in the first place."
5156,anger,I saw in a movie a block on which affluence and poverty existed. á I saw that the rich made no attempts to help the poor.
5329,shame,One morning after breakfast I was still not satisfied.  My nephew á (a small boy of 2) had not eaten his breakfast and just when I á was taking a bit of his share someone walked in.
3134,sadness,I felt sad when a friend of mine died and I felt that something á had irrevocably gone away from me.
3357,disgust,Noticing my flat had maggotts !
5488,fear,Fear of doing well on a midterm.
2682,guilt,"I couldn't fulfill a request of a girlfriend of mine, though I á categorically promised her and I believed there wouldn't be any á hindrance. It was partly for objective reasons but also because á I couldn't organize myself."
5732,anger,"A co-worker and I had to rush a project. I was only working there á for one month and he for some years. Instead of letting me know á that he wanted to do the project himself, he went to the á superviser and let the superviser tell me to let the co-worker do á it himself since he was quicker at it."
2727,disgust,"I felt disgust with a man I had trusted and respected, to whose á problems I had always shown deep understanding."
4462,anger,"My sister came back home and reproached me for not having tidied á up the house, although I had been working all morning and she had á done nothing."
185,anger,"In the holiday cottage of our association, two of my pals came to á wake me up early one morning by bringing a radio played at the á highest volume into my room - it was the morning service at its á loudest."
911,sadness,Love problems.
4918,sadness,When my grandfather died.
392,anger,"When my friend, as usual, forgot the tickets at home for a á performance.  We missed it."
4284,shame,"The first time that I caressed a girl, I was about thirteen and á she was eighteen.  I noticed that it did not affect her at all."
5920,anger,"I was to meet a friend at the bus-stop (he was coming to visit á us) and he did not turn up.  After having waited for him for some time     á (about an hour) I called him up, to be told that he did not á intend to come as he was feeling tired."
6066,anger,"I experience this emotion quite often but the day I was most á angry was the day I got pulled up for something I had not done.  á It happened during my school days, I had not spoken a word in á class but the monitor had written my name on the board.  So I á had a remark in my callender which I had to get signed by my á parents.  This remark resulted in me being spanked."
3566,disgust,I was once raped (one year ago) by a man who was a lot older than á me and whom I just met. Maybe it wasn't rape but the man wanted á more than I wanted to give him since there were other people in á vicinity.
4491,sadness,"The holidays come to an end, and the next day we had to go back á to University and to the exams."
4780,shame,"When I was leaving home I decided to leave without saying á good-bye to my young brother.  My brother saw me and said,        á \ Will you not say good-bye to me?\""  He is only 31/2 years old. """
6802,anger,I was so angry with a patient who refused to take drugs.
2346,fear,"Afraid of getting alone without friends, without anybody."
474,joy,When my husband and I decided to take a few days holiday after a á particularly trying period.
1998,disgust,When after a party celebrating a friend's 21st birthday - upon á leaving I found 10 people outside throwing up and further 4 á unconscious.
6421,fear,I was given a wristwatch by my first girl and after two days á another girl of mine also gave me a wristwatch.
2820,anger,"In the house where I live there is a new flatmate. His friends á unfortunately are the dirt of society, intelligent, fashonable, á rich and bored. At a party recently they were doing things I á didn't like done in my house. I felt angry at them."
3176,sadness,When I saw my niece (5 yrs) crying in the hallway for her mother á who had passed away about a month ago.
4794,shame,I was very drunk at a certain wedding party and I got involved in á a fight.
3101,shame,I feel ashamed when I act dishonestly toward somebody.
5650,sadness,When my boyfriend said he did not want to see me anymore (which á turned out to be untrue).
6244,disgust,Saw a dirty street.
962,shame,"At the funeral of my uncle, I was one of the bearers.  I was not á familiar with the etiquette and acted tactlessly because of my á ignorance."
5399,fear,"When I saw the movie \Poltergist\""."""
7290,fear,When the doctor told me that there was something wrong with my á eye and I had to undergo an operation.
7377,shame,Acting in a play at the orientation camp made me feel timid.
125,guilt,"When I am dishonest to a friend to whom I am very close.  I á feel guilty because I know that he gives a different version of á the truth and I have not corrected these mistakes, and he is á aware that I know that they are wrong."
598,joy,"When I realised that I was forgiven by the God who is there, when á I realised how much God loves me and that my acceptance with him á is not based on my performance - that he loves me unconditionally á and showed that love in Christ who died because I do need á forgiveness."
750,anger,When my car suddenly broke down !
3379,shame,Felt I had not appreciated my parents enough. Regretted the á problems I'd caused.
6209,disgust,"Four weeks ago I felt very much touched to find an asciatic á patient who had asked the very morning to be tapped of the fluid, á dying in the evening. I was really disgusted because this was the á Medical staff's negligence. Had the Clinical officers done á something that very morning he might have been alive today."
1760,anger,"A friend of mine uses butter instead of oil when he is cooking. I á am always angry about that, because it is an unnecessary luxury. á Recently we both were cooking and he wanted to use butter again. á When I had already put the oil into the pan, he poured it out á again and put the butter into the pan."
2370,disgust,"I met a girl (22 years old), married. I liked her. I asked her á for a date and I kissed her. I discovered that she lived nearby á where I passed every day. I got amused thinking that her husband á would be ... or me . I didn't talked to her anymore."
3978,shame,When I went for the first time in my life to a nudist-beach.
4660,disgust,I met my best friend's husband with a prostitute.
352,disgust,When I was about to clean the draining board and saw it looked á underneath the sink (I live in a students hostel).
3016,anger,I got angry with a stranger in a train who behaved impertinently á and immorally
6957,disgust,Saw my father with that woman he is married to now.
6525,fear,One time I set up my journey at night going to a certain bar. On á the way I met my friends and they told me that two people had á died because of heavy fighting. I proceeded on but with fear.
267,sadness,The inability to read a book at college.
6236,disgust,"The time when I cleaned the house and everything was tidy, á then my cousin, who is 4 years old, came with a muddy pot and made á a mess of the whole thing."
5738,fear,Two summers ago my best friend and I drove into unknown mountains á at midnight to pick up my broken car. We told one another á horrifically scary ghost/murder stories and succeeded in scaring á eachother pretty well - even though somewhere in our heads we á knew the fears were unjustified.
5844,anger,Having my personal objects rearranged by someone else without my á consent and having it arranged to their taste. Then trying to á find a particular object they rearranged for an hour or more.
2932,disgust,"Recently in the tram, a man ran his fingers over my girlfriend á then over me."
1767,anger,I had not eaten anything for 2 days to be able to pay the fine á for my fiancT. But he stayed in another town and spent one á thousand shillings in the restaurant during the same time.
6501,shame,I was very ashamed when I was neglected by a certain friend whom á I was thinking loved me very much.
6011,sadness,"After having been ill, when I was coming back to the hostel, I á felt very sad leaving home."
2712,sadness,I felt sadness when I had to get separated from the woman I loved á who had to leave for her motherland.
6616,fear,Somebody told her friend that she would hit me wherever we would á meet.
3677,guilt,When I was 4-5 years old my mother gave me some parts of a á chocolate bar and ordered me to bring it to my father working á outside. On my way I could not resist the temptation and ate it á myself.
1468,sadness,Death of my grandmother.
4859,joy,When I saw my family after a separation of one year.
6073,anger,A new gas connection was to be installed and the mechanic who came á to do it was very rude to my mother and me.  I rushed to thhe á dealer with my mother and had a fight with the dealer as he á seemed to be unreasonable and was taking the mechanic's side.  á Ultimately the matter was resolved after my father went and spoke á to him.  The mechanic was asked to apologize.
3025,disgust,"I became disgusted with the man on whom I had counted, who I had á trusted, the man who should have been my mainstay - my father. á I could hardly make myself (and the others) believe in this á emotion. It has cumulated after events and deeds. Everything can á happen in this world."
5616,disgust,When people/press analyze a particular newsworthy item (CAL á Football team) which I am a member and can only see the situation á in a bad light and always put the team down.
339,shame,"When I made the same mistake that I had accused someone else of, and á this was obvious to a third pereson."
1249,guilt,[ I speak harshly to my parents though they only mean my own á good.]
4256,shame,We were discussing a subject ( I knew very little about it) and I á was holding my ground.  They showed me that I was wrong.
1653,guilt,I had to take care of my little brother. When I met a friend I á did not pay attention to him for a certain time and he was hurt á while he was playing.
6405,guilt,It was when I discovered that the girl who I had proposed was a á friend's girlfriend.
1868,guilt,When I was in the puberty I smashed the favourite toy of my á little brother because of a fit of rage.
6618,sadness,When I heard that my friend had started drinking beer.
3265,shame,"That my brother and father are into alcohol, two men with á priviledge. Not using it positively."
6838,sadness,My grandmother died.
5963,disgust,"I do not like one of our neighbours as they are very selfish.  á Whenever they want something or need help they come to see us,  á otherwise they do not even bother about people who live next to á them."
7367,anger,Before the certificate examination I was very poor in Biology á (the worst result in my class).  Ever since F.5 it had been á getting poorer and poorer.  I had tried my best and had spent á most of my time studying this subject.  Finally my results were á so bad that I thought that it was just not fair.
5846,disgust,"Getting back my math midterm, I received a lower grade than I á thought I would get. After going through the questions I felt á that the grader had graded harshly and I had made only a few ? á errors."
7486,anger,"During a football match, the other team was rude and they hurt my á team members and me.  The coach was prejudiced against us and á punished us unreasonably.  Later we fought with each other and á the match had to be cut short."
5863,joy,I realized the girl liked to be with me.
1148,sadness,I felt sad at having to leave my girlfriend after constant problems á and failed attempts at reconciliation.  My sadness was caused by á the irreversibility of the decision.
498,sadness,When my dad gives priority to my kid brother's band and his á other activities.  We both play in different bands and rehearse á in my parents garage.
4543,guilt,When I was young I felt guilty because I thought that I had á commited a grave sin.
5160,fear,I was walking home from a place on southside and I live on á Northside and I was followed. I headed my most direct route.
